Arabic Number,English Number,Arabic Article,Article Number (EN),Text
٦٣,63,مادة (٦٣) :,63.0,يكون تشغيل أو تدريب الأطفال ، وتحديد الظروف والأحوال والقواعد والإجراءات التى يتم فيها ذلك ، وفقًا للقرار الصادر من الوزير المختص بالتنسيق مع المجلس القومى للطفولة والأمومة .
٦٤,64,مادة (٦٤) :,64.0,يُحظر تشغيل أو تدريب الأطفال فى الأعمال ، والمهن ، والصناعات التى من شأنها أن تعرض صحتهم البدنية أو النفسية أو سلامتهم أو أخلاقهم للخطر ، أو تعوقهم عن مواصلة التعليم كما يحظر تشغيلهم أو تدريبهم فى أى عمل غير مشروع ، أو أية أعمال تعتبر من صور أسوأ أشكال عمل الأطفال وفقًا للاتفاقيات والمواثيق والمعاهدات الدولية التى صدقت عليها جمهورية مصر العربية .
٦٥,65,مادة (٦٥) :,65.0,يُحظر تشغيل الطفل أكثر من ست ساعات يوميًا ، ويجب أن تتخلل ساعات العمل فترة أو أكثر لتناول الطعام والراحة لا تقل فى مجموعها عن ساعة واحدة ،وتحدد هذه الفترة أو الفترات بحيث لا يعمل الطفل أكثر من أربع ساعات متصلة ، ويحظر تشغيل الطفل ساعات عمل إضافية أو تشغيله فى أيام الراحة الأسبوعية والعطلات الرسمية .
٦٦,66,مادة (٦٦) :,66.0,على صاحب العمل الذى يقوم بتشغيل طفل أو أكثر مراعاة الآتى :
٦٧,67,مادة (٦٧) :,67.0,مع عدم الإخلال بأحكام قانون الطفل المشار إليه ، تقوم جهات التأهيل بإخطار الجهة الإدارية المختصة التى يقع فى دائرتها محل إقامة الطفل ذى الإعاقة بما يفيد تأهيله ، وتقيد لديها أسماء الأطفال الذين تم تأهيلهم فى سجل خاص ورقىأو إلكتروني ، وتسلم إلى الطفل ذى الإعاقة أو من ينوب عنه شهادة القيد دون مقابل .
٦٨,68,مادة (٦٨) :,68.0,يُحظر على الأبوين أو متولى أمر الطفل ، بحسب الأحوال ، تشغيل الطفل بالمخالفة لأحكام هذا القانون ، والقرارات التنفيذية الصادرة له .
٦٩,69,مادة (٦٩) :,69.0,يقصد بالعمل فى تطبيق أحكام هذا الفصل كل عمل تابع أو حر أو لحساب النفس أو العمل فى أى مهنة أو صنعة أو حرفة بما فى ذلك العمل فى الخدمة المنزلية .
۷۰,70,مادة (۷۰) :,70.0,يخضع عمل الأجانب فى جميع منشآت القطاع الخاص ، ووحدات القطاع العام ، وقطاع الأعمال العام ، والهيئات العامة والإدارة المحلية ، والجهاز الإدارى للدولة للأحكام الواردة فى هذا الفصل ، وذلك مع مراعاة شرط المعاملة بالمثل .
۷۱,71,مادة (۷۱) :,71.0,لا يجوز للأجنبى العمل داخل البلاد إلا بعد الحصول على ترخيص بذلكمن الوزارة المختصة وأن يكون مصرحًا له بدخول البلاد والإقامة بها بقصد العمل ، ولا يجوز لأصحاب الأعمال تشغيل الأجانب إلا بعد الحصول على هذا الترخيص .
۷۲,72,مادة (۷۲) :,72.0,يلتزم صاحب العمل بإبلاغ الجهة الإدارية والسلطات المختصة عن غياب العامل الأجنبى عن العمل لمدة خمسة عشر يومًا متصلة دون مسوغ قانونى يجيز ذلك ، ويصدر الوزير المختص قرارًا بالضوابط والشروط والإجراءات المنظمة لذلك .
۷۳,73,مادة (۷۳) :,73.0,مع عدم الإخلال بأحكام قانون الاستثمار الصادر بالقانون رقم ٧٢ لسنة ٢٠١٧ ، يجوز للوزير المختص بالاتفاق مع الوزير المعنى بشئون الاستثمار ، وضع القواعد والضوابط اللازمة للترخيص بالعمل للأجانب المخاطبين بأحكام قانون الاستثمار المشار إليه .
٧٤,74,مادة (٧٤) :,74.0,يلتزم صاحب العمل الذى يعمل لديه الأجنبى بإعادته إلى الدولة التى تم استقدامه منها على نفقة صاحب العمل الخاصة حال انتهاء علاقة العمل ، ما لم ينص عقد العمل على خلاف ذلك .
٧٥,75,مادة (٧٥) :,75.0,تهدف أحكام هذا الباب إلى تنظيم ودعم وتشغيل العمالة غير المنتظمة والعاملين فى القطاع غير الرسمى على المستوى القومى ، ومساعدتهم فى الحصول على فرص العمل اللائقة لهم ، وتنمية مهاراتهم بما يتناسب مع احتياجات سوق العمل فى الداخل والخارج ، وحمايتهم أثناء العمل ، وتقديم الدعم اللازم أثناء فترات التعطل .
٧٦,76,مادة (٧٦) :,76.0,تتولى الوزارة المختصة رسم سياسة ومتابعة تشغيل العمالة غير المنتظمة وعلى الأخص عمال الزراعة الموسميون ، وعمال المقاولات وعمال البحر ، وعمال المناجم والمحاجر ، بما يتفق مع السياسة العامة للدولة .
۷۷,77,مادة (۷۷) :,77.0,تلتزم الجهة الإدارية المختصة بحصر وقيد العمالة غير المنتظمة ، وفقًا لتصنيفها وفئاتها ، فى السجلات الورقية أو الإلكترونية المعدة لذلك .
۷۸,78,مادة (۷۸) :,78.0,"ينشأ صندوق لحماية وتشغيل العمالة غير المنتظمة يسمى ""صندوق إعانات الطوارئ والخدمات الاجتماعية والصحية للعمالة غير المنتظمة"" ، تكون له الشخصية الاعتبارية العامة ، ويتبع الوزير المختص ، ويكون مقره الرئيسى محافظة القاهرة ، وله أن ينشئ فروعًا فى المحافظات ."
۷۹,79,مادة (۷۹) :,79.0,يختص الصندوق بما يأتي :
۸۰,80,مادة (۸۰) :,80.0,يُصدر الوزير المختص بالتشاور مع الوزراء المعنيين اللوائح المالية والإدارية للصندوق ، ونظام تحصيل موارده ، ولائحة الخدمات التى يقدمها ، وقيمة الإعانات المالية الطارئة وضوابط استحقاقها ، ومدتها ، وحالات وقفها ، والمستندات اللازمة لإثباتها ، وطريقة وآليات صرفها .
۸۱,81,مادة (۸۱) :,81.0,يجوز بقرار من رئيس الجمهورية فى حالات الطوارئ العامة صرف إعانات طوارئ عاجلة لفئات العمالة غير المنتظمة أو بعضها ، أو لأسرهم ، وذلك فى الحالات والأحوال التى يحددها القرار .
۸۲,82,مادة (۸۲) :,82.0,تتكون موارد الصندوق مما يأتي :
۸۳,83,مادة (۸۳) :,83.0,يكون للصندوق حساب خاص لدى أحد البنوك التجارية المسجلة لدى البنك المركزى المصرى وموازنة مستقلة ، تعد على نمط موازنات الهيئات العامة الاقتصادية ، ويعد الصندوق سنويًا القوائم الدالة على المركز المالى وفقًا لنظام المحاسبة المالية ، وتبدأ السنة المالية للصندوق مع السنة المالية للدولة ، وتنتهى بانتهائها ، وتخضع أمواله لرقابة الجهاز المركزى للمحاسبات ، ويُرحل فائض أمواله من سنة مالية إلى أخرى .
٨٤,84,مادة (٨٤) :,84.0,تعد أموال الصندوق أموالاً عامة ، وبصفة خاصة فيما يتعلق بتطبيق أحكام قانون العقوبات . وللصندوق الحق فى اتخاذ إجراءات التنفيذ المباشر والحجز الإدارى وفقًا لأحكام القانون رقم ۳۰۸ لسنة ١٩٥٥ فى شأن الحجز الإدارى .
٨٥,85,مادة (٨٥) :,85.0,يلتزم العاملون بالوزارة المختصة ومديرياتها كل فى حدود اختصاصه ،بتنفيذ أحكام هذا الباب وما يصدر عن مجلس إدارة الصندوق من لوائح وقرارات بالتنسيق مع إدارة الصندوق ، ويصدر قرار من الوزير المختص بقواعد وإجراءات وآليات التنسيق .
٨٦,86,مادة (٨٦) :,86.0,تسرى أحكام هذا الفصل على العقد الذى يتعهد بمقتضاه عامل بأن يعمل لدى صاحب عمل تحت إدارته أو إشرافه لقاء أجر .
۸۷,87,مادة (۸۷) :,87.0,يبرم عقد العمل الفردى لمدة غير محددة ، أو لمدة محددة إذا كانت طبيعة العمل تقتضى ذلك كما يجوز باتفاق الطرفين تجديد العقد لمدد أخرى مماثلة .
۸۸,88,مادة (۸۸) :,88.0,يُعتبر عقد العمل غير محدد المدة منذ إبرامه فى الحالات الآتية :
۸۹,89,مادة (۸۹) :,89.0,يلتزم صاحب العمل بتحرير عقد العمل كتابة باللغة العربية من أربع نسخ ، يحتفظ صاحب العمل بنسخة ، وتسلم نسخة للعامل ، وتودع الثالثة بمكتب التأمين الاجتماعى المختص ، والنسخة الرابعة بالجهة الإدارية المختصة .
۹۰,90,مادة (۹۰) :,90.0,تحدد فترة الاختبار فى عقد العمل لمدة لا تزيد على ثلاثة أشهر .
۹۱,91,مادة (۹۱) :,91.0,لا يجوز لصاحب العمل أن يخرج على الشروط المتفق عليها فى عقد العمل الفردى ، أو اتفاقية العمل الجماعية ، أو أن يكلف العامل بعمل غير المتفق عليه ،إلا إذا دعت الضرورة إلى ذلك ، منعًا لوقوع حادث ، أو لإصلاح ما نشأ عنه ،أو فى حالة القوة القاهرة ، على أن يكون ذلك بصفة مؤقتة ، وله أن يكلف العامل بعمل غير المتفق عليه ، إذا كان لا يختلف عنه اختلافًا جوهريًا .
۹۲,92,مادة (۹۲) :,92.0,على صاحب العمل أن ينشئ ملفًا ورقيًا أو إلكترونيًا لكل عامل يتضمن اسمه ، ومهنته ، ودرجة مهارته عند التحاقه بالعمل ، ومحل إقامته ، وحالته الاجتماعية ، وتاريخ بداية خدمته ، وأجره ، وبيان ما يطرأ عليه من تطورات والجزاءات التى وقعت عليه ، وبيان ما حصل عليه من إجازات ، وأن يدرج أو يودع فى الملف صورة من عقد العمل ، ومحاضر التحقيق إن وجدت ، وتقارير رؤسائه عن عمله وفقًا لما تقرره لائحة المنشأة ، وأية أوراق أخرى تتعلق بخدمة العامل وما يفيد التأمين عليه لدى الهيئة القومية للتأمين الاجتماعي ، والكشف الطبى الابتدائى ، ولا يجوز الاطلاع على هذه البيانات إلا لمن رخص له قانونًا بذلك ، وأن يقدم هذا الملف إلى الجهة الإدارية المختصة أو المحكمة العمالية المختصة حسب الأحوال عند طلبه .
۹۳,93,مادة (۹۳) :,93.0,يلتزم صاحب العمل ، بنقل العامل من الجهة التى تم التعاقد معه فيها إلى مكان العمل ، كما يلتزم بإعادته إلى تلك الجهة خلال ثلاثة أيام من تاريخ انتهاء عقد العمل لأحد الأسباب المبينة فى هذا القانون ، ولو كان خلال فترة الاختبار ، إلا إذا رفض العامل كتابة العودة خلال المدة المشار إليها .
٩٤,94,مادة (٩٤) :,94.0,إذا عهد صاحب العمل إلى صاحب عمل آخر بتأدية عمل من أعماله ، أو جزء منها ، وذلك فى منطقة عمل واحدة وجب على الأخير أن يسوى بين عماله ، وعمال صاحب العمل الأصلى فى جميع الحقوق ، ويكون الأخير متضامنًا معه فى الوفاء بجميع الالتزامات التى تفرضها أحكام هذا القانون .
٩٥,95,مادة (٩٥) :,95.0,يلتزم العامل الذى تم تدريبه على نفقة صاحب العمل بأن يقضى لديه المدة المتفق عليها ، وفى حالة تركه العمل قبل انقضاء هذه المدة يلتزم بسداد نفقات التدريب ، دون إخلال بحق صاحب العمل فى التعويض ، ما لم ينص عقد العمل على خلاف ذلك .
٩٦,96,مادة (٩٦) :,96.0,يعتبر نمطًا جديدًا من أنماط العمل كل عمل يقوم به العامل بطريقة غير تقليدية ، أيًا كان شكل أداء العمل ، أو طريقة تنفيذه ، ويقدم لصالح صاحب العمل وتحت إدارته أو إشرافه ، مقابل أجر أيًا كانت صورته ، ويعتبر نمطًا من أنماط العمل الجديدةعلى الأخص ما يأتي :
۹۷,97,مادة (۹۷) :,97.0,تسرى على علاقات العمل فى أنماط العمل الجديدة ما يسرى على علاقاتالعمل التقليدية ، وذلك مع مراعاة طبيعة كل عمل وطريقة أدائه .
۹۸,98,مادة (۹۸) :,98.0,يجوز باتفاق الطرفين فى أنماط العمل الجديدة أن يقوم العامل بالعمل لدى أكثر من صاحب عمل مع التزام العامل بعدم إفشاء أسرار العمل ، أو أن يعمل لحساب نفسه إلى جانب عمله لدى الغير .
۹۹,99,مادة (۹۹) :,99.0,يجب أن تكون علاقة العمل فى أنماط العمل الجديدة واضحة ومحددة فى عقد عمل مكتوب ورقيًا أو إلكترونيًا ، ويجوز للعامل إثبات علاقة العمل بكافةطرق الإثبات .
۱۰۰,100,مادة (۱۰۰) :,100.0,يُصدر الوزير المختص بالتشاور مع المنظمات النقابية العمالية ومنظمات أصحاب الأعمال القرارات اللازمة لتنظيم أنماط العمل الجديدة ، وتحديد صورها والنماذج الاسترشادية لعقود ولوائح العمل ، وطرق إثبات علاقة العمل ، وآليات حصول الطرفين على حقوقهم ، وذلك فى موعد لا يتجاوز ستة أشهر من تاريخ إصدار هذا القانون .
۱۰۱,101,مادة (۱۰۱) :,101.0,يُشكل المجلس القومى للأجور برئاسة الوزير المعنى بشئون التخطيط والتنمية الاقتصادية والتعاون الدولى ، وعضوية كل من :
۱۰۲,102,مادة (۱۰۲) :,102.0,يختص المجلس المشار إليه فى المادة (101) من هذا القانون على وجهالخصوص بالآتي :
۱۰۳,103,مادة (۱۰۳) :,103.0,يجتمع المجلس القومى للأجور بدعوة من رئيسه كل ستة أشهر على الأقل ،أو كلما دعت الحاجة إلى ذلك ، وتكون اجتماعاته صحيحة بحضور أغلبية الأعضاء ، وتصدر قراراته بأغلبية أراء الحاضرين من أعضائه ، وعند التساوى يرجح الجانب الذي منه الرئيس .
١٠٤,104,مادة (١٠٤) :,104.0,تلتزم المنشآت الخاضعة لأحكام هذا القانون بتنفيذ قرارات المجلس القومى للأجور ، كل فيما يخصها .
١٠٥,105,مادة (١٠٥) :,105.0,يتعين على أجهزة التفتيش بالوزارة المختصة القيام بإجراء التفتيش الدورى على المنشآت الخاضعة لأحكام هذا القانون للتحقق من تنفيذ قرارات المجلس القومى للأجور ، وعلى أصحاب الأعمال أو من يمثلونهم ، إمساك سجلات ورقيةأو إلكترونية تتضمن بيانات العاملين والأجر المستحق لكل عامل .
١٠٦,106,مادة (١٠٦) :,106.0,مع عدم الإخلال بالاختصاص المقرر لمحاكم مجلس الدولة ، لكل ذى مصلحة الطعن على القرارات الصادرة عن المجلس القومى للأجور فى طلبات أصحاب الأعمال بالتخفيض أو الإعفاء من صرف العلاوة الدورية السنوية أمام المحكمة العمالية ، وذلك خلال ثلاثين يومًا من التاريخ المقرر لصرف العلاوة أو الإخطار بالقرار المطعون فيه ، بحسب الأحوال .
۱۰۷,107,مادة (۱۰۷) :,107.0,يحدد الأجر وفقًا لعقد العمل الفردى ، أو اتفاقية العمل الجماعية ، أو لائحة المنشأة المعتمدة ، فإذا لم يحدد بأى من هذه الطرق استحق العامل أجر المثلإن وجد ، وإلا قدر الأجر طبقًا لعرف المهنة فى الجهة التى يؤدى فيها العمل ، فإن لم يوجد عرف تولى قاضى الأمور الوقتية بالمحكمة العمالية المختصة تقدير الأجر وفقًا لمقتضيات العدالة ، مع مراعاة أحكام هذا القانون .
۱۰۸,108,مادة (۱۰۸) :,108.0,تؤدى الأجور وغيرها من المبالغ المستحقة للعامل فى أحد أيام العمل وفى مكانه بالعملة المتداولة قانونًا ، أو فى حساب العامل البنكى ، مع مراعاة الأحكام التالية :
۱۰۹,109,مادة (۱۰۹) :,109.0,يكون حساب متوسط الأجر اليومى لعمال الإنتاج ، أو العمال الذين يتقاضون أجورًا أساسية مضافًا إليها عمولة أو نسبة مئوية على أساس متوسط ما تقاضاه العامل عن أيام العمل الفعلية فى السنة الميلادية السابقة ، أو عن المدة التى اشتغلها إن قلت عن ذلك مقسومًا على عدد أيام العمل الفعلية عن ذات الفترة .
۱۱۰,110,مادة (۱۱۰) :,110.0,يُحظر على صاحب العمل أن ينقل العامل من فئة عمال الأجر الشهرى إلى فئة عمال اليومية ، أو بالأجر الأسبوعى ، أو بالساعة ، أو بالإنتاج ، إلا بعد موافقته ، ويكون للعامل فى هذه الحالة جميع الحقوق التى اكتسبها فى المدة التى قضاهابالأجر الشهري .
۱۱۱,111,مادة (۱۱۱) :,111.0,إذا حضر العامل إلى مقر عمله فى الوقت المحدد للعمل ، وكان مستعدًالمباشرة عمله ، وحالت دون ذلك أسباب ترجع إلى صاحب العمل ، اعتبر كأنه أدى عمله فعلاً واستحق أجره كاملاً ، أما إذا حضر وحالت بينه وبين مباشرة عمله أسباب قهرية خارجة عن إرادة صاحب العمل استحق نصف أجره .
۱۱۲,112,مادة (۱۱۲) :,112.0,لا يجوز لصاحب العمل إلزام العامل بشراء أغذية ، أو سلع أو خدماتمن محال معينة ، أو مما ينتجه صاحب العمل من سلع ، أو ما يقدمه من خدمات .
۱۱۳,113,مادة (۱۱۳) :,113.0,لا يجوز لصاحب العمل أن يقتطع من أجر العامل أكثر من عشرة بالمائة ،وفاء لما يكون قد أقرضه من مال أثناء سريان العقد ، أو أن يتقاضى أية فائدة عن هذه القروض ، ويسرى هذا الحكم على الأجور المدفوعة مقدمًا .
١١٤,114,مادة (١١٤) :,114.0,مع عدم الإخلال بأحكام قانون تنظيم بعض أوضاع وإجراءات التقاضى فى مسائل الأحوال الشخصية الصادر بالقانون رقم ١ لسنة ۲۰۰۰ ، لا يجوز فى جميع الأحوال الاستقطاع أو الحجز ، أو النزول عن الأجر المستحق للعامل لأداء أى دين إلا فى حدود خمسة وعشرين بالمائة من هذا الأجر ، ويجوز رفع نسبة الخصم إلى خمسين بالمائة فى حالة دين النفقة .
١١٥,115,مادة (١١٥) :,115.0,لا تبرأ ذمة صاحب العمل من الأجر إلا إذا وقع العامل بما يفيد استلام الأجرفى السجل المعد لذلك ، أو فى كشوف الأجور ، أو إتمام تحويل أجره ومستحقاته إلى حسابه بأحد البنوك ، ويلتزم صاحب العمل بإعطاء العامل بيانًا بمفردات أجره .
١١٦,116,مادة (١١٦) :,116.0,مع مراعاة حكم المادة (115) من هذا القانون ، يسلم صاحب العمل إلى عمالهمن الأطفال أجورهم أو مكافآتهم أو غير ذلك مما يستحقونه قانونًا . ويكون هذا التسليم مبرئًا لذميه .
۱۱۷,117,مادة (۱۱۷) :,117.0,مع عدم الإخلال بأحكام القانون رقم ١٣٣ لسنة ١٩٦١ فى شأن تنظيم تشغيل العمال فى المنشآت الصناعية ، لا يجوز تشغيل العامل تشغيلاً فعليًا أكثر من ثمانى ساعات فى اليوم ، أو ثمان وأربعين ساعة فى الأسبوع ، ولا تدخل فيها الفترات المخصصة لتناول الطعام والراحة .
۱۱۸,118,مادة (۱۱۸) :,118.0,يجب أن تتخلل ساعات العمل فترة أو أكثر لتناول الطعام والراحة ، ولا تقلفى مجموعها عن ساعة ويراعى فى تحديد هذه الفترة ألا يعمل العامل أكثر من خمس ساعات متصلة .
۱۱۹,119,مادة (۱۱۹) :,119.0,يجب تنظيم ساعات العمل وفترات الراحة ، بحيث لا تجاوز الفترة بين بداية ساعات العمل ونهايتها أكثر من عشر ساعات فى اليوم الواحد ، وتحسب فترة الراحة من ساعات التواجد ، إذا كان العامل أثناءها فى مكان العمل .
۱۲۰,120,مادة (۱۲۰) :,120.0,يجب تنظيم العمل بالمنشأة بحيث يحصل كل عامل على راحة أسبوعية لا تقل عن أربع وعشرين ساعة كاملة بعد ستة أيام عمل متصلة على الأكثر ، وفى جميع الأحوال تكون الراحة الأسبوعية مدفوعة الأجر .
۱۲۱,121,مادة (۱۲۱) :,121.0,يجوز لصاحب العمل عدم التقيد بالأحكام الواردة بالمواد (117 ، ۱۱۸ ، ۱۱۹ ، ۱۲۰) من هذا القانون ، إذا كان التشغيل بقصد مواجهة ضرورات عمل غير عادية ، أو ظروف استثنائية ، ويشترط فى هذه الحالات إبلاغ الجهة الإدارية المختصة فى خلال سبعة أيام من وقوع ظروف العمل غير العادية أو الظروف الاستثنائية بمبررات التشغيل الإضافى والمدة اللازمة لإتمام العمل .
۱۲۲,122,مادة (۱۲۲) :,122.0,على صاحب العمل أن يضع بالمداخل الرئيسية التى يستعملها العمال ، أو فى مكان ظاهر بالمنشأة جدولاً ببيان يوم الراحة الأسبوعية ، وساعات العمل ، وفترات الراحة المقررة لكل العاملين ، وما يطرأ على هذا الجدول من تعديل مع إخطار الجهة الإدارية المختصة بصورة من هذا الجدول ، أو ما يطرأ عليه من تعديل خلال سبعة أيام من تنفيذه على الأكثر .
۱۲۳,123,مادة (۱۲۳) :,123.0,لا تسرى أحكام المواد (۱۱۷ ، ۱۱۸ ، ۱۱۹ ، ۱۲۰ / فقرة ثانية) من هذا القانون على الفئات الآتية :
١٢٤,124,مادة (١٢٤) :,124.0,يستحق العامل إجازة سنوية بأجر ، لا يدخل فى حسابها أيام عطلات الأعياد والمناسبات الرسمية والراحة الأسبوعية ، وذلك على الوجه الآتى :
