Arabic Number,English Number,Arabic Article,Article Number (EN),Text
125,125,مادة (125) :,125.0,يحدد صاحب العمل مواعيد الإجازة السنوية حسب مقتضيات العمل وظروفه ، ولا يجوز قطعها إلا لأسباب قوية تقتضيها مصلحة العمل .
١٢٦,126,مادة (١٢٦) :,126.0,للعامل الحق فى تحديد موعد إجازته السنوية إذا كان متقدمًا لأداء الامتحانفى إحدى مراحل التعليم بشرط أن يخطر صاحب العمل قبل قيامه بالإجازةبخمسة عشر يومًا على الأقل .
۱۲۷,127,مادة (۱۲۷) :,127.0,لصاحب العمل أن يحرم العامل من أجره عن مدة الإجازة ، أو يسترد ما أداهمن أجر عنها ، إذا ثبت اشتغاله خلالها لدى الغير ، وذلك دون إخلال بالجزاء التأديبي .
۱۲۸,128,مادة (۱۲۸) :,128.0,للعامل أن ينقطع عن العمل لسبب عارض لمدة لا تجاوز سبعة أيام خلال السنة ، وبحد أقصى يومان فى المرة الواحدة ، وتحسب الإجازة العارضة من الإجازة السنوية المقررة للعامل .
۱۲۹,129,مادة (۱۲۹) :,129.0,للعامل الحق فى إجازة بأجر فى العطلات والأعياد والمناسبات التى يصدر بتحديدها قرار من الوزير المختص ، وتسرى بالنسبة للأعياد الدينية لغير المسلمين أحكام قرار مجلس الوزراء الصادر فى هذا الشأن .
۱۳۰,130,مادة (۱۳۰) :,130.0,للعامل الذى أمضى فى خدمة صاحب عمل خمس سنوات متصلة ، الحق فى إجازة بأجر لمدة شهر لأداء فريضة الحج ، أو زيارة بيت المقدس ، وتكون هذه الإجازة مرة واحدة طوال مدة خدمته .
۱۳۱,131,مادة (۱۳۱) :,131.0,للعامل الذى يثبت مرضه ، أو إصابته على نحو يحول بينه وبين أداء عمله الحق فى إجازة مرضية تحددها الجهة الطبية المختصة ، ويستحق العامل خلالها تعويضًا عن الأجر ، تحدد نسبته ومدته ، وفقًا لأحكام قانون التأمينات الاجتماعية والمعاشات المشار إليه .
۱۳۲,132,مادة (۱۳۲) :,132.0,للجهة الطبية المختصة منع العامل المخالط لمريض بمرض معد من أحد أفراد أسرته من مزاولة عمله المدة المناسبة بما لا يجاوز ثلاثة أشهر ، وتحدد هذه الأمراض بقرار من الوزير المعنى بشئون الصحة ، كما يحدد القرار الجهة الطبية المختصة المشار إليها .
۱۳۳,133,مادة (۱۳۳) :,133.0,تثبت عدم اللياقة للخدمة صحيًا وفقًا لأحكام قانون التأمينات الاجتماعية والمعاشات المشار إليه .
١٣٤,134,مادة (١٣٤) :,134.0,يجب على العامل ما يأتي :
١٣٥,135,مادة (١٣٥) :,135.0,مع عدم الإخلال بأحكام القانون رقم ١٣٧ لسنة ١٩٥٨ فى شأن الاحتياطات الصحية للوقاية من الأمراض المعدية بالإقليم المصرى ، ومع مراعاة أحكام المادتين (۱۳۲و۱۳۸) من هذا القانون يلتزم العامل بالخضوع للاختبارات الطبية عن تعاطى المواد المخدرة أو الأمراض المعدية حينما يطلب منه صاحب العمل ذلك وعلى نفقته ، ويتم الاختبار الطبى بالهيئة العامة للتأمين الصحى أو المعامل المركزية بوزارة الصحة .
١٣٦,136,مادة (١٣٦) :,136.0,يُحظر على العامل أن يقوم بنفسه ، أو بواسطة غيره بالأعمال الآتية :
۱۳۷,137,مادة (۱۳۷) :,137.0,على كل صاحب عمل يستخدم عشرة عمال فأكثر أن يُعد لائحة بقواعد تنظيم العمل وفقًا لطبيعة النشاط ، على أن تتضمن على الأخص نظم الترقى ، والنقل ، والأجور ، والمخالفات التى تمثل خروجًا على مقتضى الواجب الوظيفى ، والجزاءات التأديبية ، خلال ستين يومًا من بداية عمل المنشأة أو تاريخ توافر هذا النصاب ،أو نفاذ هذا القانون ، بحسب الأحوال ، وعليه تسليم الجهة الإدارية المختصة نسخة من اللائحة لمراجعتها والتصديق عليها وعلى الجهة الإدارية المختصة استطلاع رأى المنظمة النقابية العمالية المختصة والتى يتعين عليها إبداء رأيها إلى الجهة الإدارية المختصة فى موعد لا يتجاوز خمسة عشر يومًا من تاريخ تسلمها للائحة وإلا اعتبر ذلك بمثابة موافقة على اللائحة ، فإذا لم تقم الجهة الإدارية المختصة بالتصديق ،أو الاعتراض على اللائحة خلال ثلاثين يومًا من تاريخ استلامها اعتبرت اللائحة نافذة .
۱۳۸,138,مادة (۱۳۸) :,138.0,يشترط فى الفعل الذى تجوز مساءلة العامل عنه تأديبيًا أن يكون ذا صلة بالعمل ، وتحدد لائحة الجزاءات المخالفات والجزاءات المقررة لها ، وفقًا لما هو منصوص عليه فى المادة (139) من هذا القانون وبما يحقق تناسب الجزاء مع المخالفة .
۱۳۹,139,مادة (۱۳۹) :,139.0,الجزاءات التأديبية التى يجوز توقيعها على العامل وفقًا للوائح تنظيم العمل والجزاءات فى المنشأة هي :
١٤٠,140,مادة (١٤٠) :,140.0,لا يجوز لصاحب العمل توقيع أكثر من جزاء عن المخالفة الواحدة ، كمالا يجوز له الجمع بين اقتطاع جزء من أجر العامل تطبيقًا لحكم المادة (139) من هذا القانون وبين أى جزاء مالي ، إذا زاد ما يجب اقتطاعه على أجر خمسة أيامفى الشهر الواحد .
١٤١,141,مادة (١٤١) :,141.0,لا يجوز توقيع جزاء على العامل إلا بعد إبلاغه كتابة بما نسب إليه وسماع أقواله ، وتحقيق دفاعه وإثبات ذلك فى محضر يودع فى ملفه الخاص ، على أن يبدأ التحقيق خلال سبعة أيام على الأكثر من تاريخ اكتشاف المخالفة ولا يتجاوز ثلاثة أشهرمن تاريخ بداية التحقيق ويجوز أن تزاد ثلاثة أشهر أخرى إذا تكشف أثناء التحقيق وقائع أو مستندات جديدة ، وللمنظمة النقابية التى يتبعها العامل أن تندب ممثلاً عنها لحضور التحقيق .
١٤٢,142,مادة (١٤٢) :,142.0,تختص الشئون القانونية بالمنشأة بالتحقيق مع العامل ، وفى حالة عدم وجودها فلصاحب العمل أن يعهد بالتحقيق فى موضوع المخالفة إلى شخص آخر من ذوى الخبرة أو أحد العاملين بالمنشأة ، بشرط ألا يقل المستوى الوظيفى للمحقق عن مستوى العامل الذى يحقق معه .
١٤٣,143,مادة (١٤٣) :,143.0,لا يجوز لصاحب العمل أن يوقع جزاء الخصم على العامل عن المخالفة الواحدة بما يزيد على خمسة أيام من الأجر الأساسي ، كما لا يجوز أن يقتطع من هذا الأجر وفاء للجزاءات التى يوقعها أكثر من أجر خمسة أيام فى الشهر الواحد .
١٤٤,144,مادة (١٤٤) :,144.0,يجوز تشديد الجزاء إذا عاد العامل إلى ارتكاب مخالفة جديدة من نوع المخالفة التى سبق مجازاته عليها ، متى وقعت هذه المخالفة خلال سنة من تاريخ إبلاغ العامل بتوقيع الجزاء السابق .
١٤٥,145,مادة (١٤٥) :,145.0,لصاحب العمل أن يوقف العامل عن عمله مؤقتًا بموجب قرار مكتوب لمدةلا تزيد على ستين يومًا مع صرف أجره كاملاً ، وذلك فى الحالات الآتية :
١٤٦,146,مادة (١٤٦) :,146.0,للعامل التظلم من قرار وقفه عن العمل الصادر وفقًا للبندين (١ ، 2) من المادة (145) من هذا القانون بموجب عريضة تقدم لقاضى الأمور الوقتية بالمحكمة العمالية المختصة ، وذلك خلال ثلاثة أيام من تاريخ إخطاره ، أو علمه بصدور القرارالمتظلم منه .
١٤٧,147,مادة (١٤٧) :,147.0,لصاحب العمل أن يطلب من قاضى الأمور الوقتية بالمحكمة العمالية المختصة مد فترة الإيقاف عن العمل لمدة أو لمدد أخرى مع صرف نصف أجر العامل وذلك قبل انتهاء مدة الإيقاف بعشرة أيام .
١٤٨,148,مادة (١٤٨) :,148.0,يكون الاختصاص بتوقيع جزاء الفصل من العمل للمحكمة العمالية المختصة ، ويكون توقيع باقى الجزاءات التأديبية لصاحب العمل ، أو من يفوضه لذلك ،ويكون لمدير المنشأة توقيع جزائى الإنذار الكتابى ، والخصم من الأجر لمدة لا تجاوز ثلاثة أيام .
١٤٩,149,مادة (١٤٩) :,149.0,مع عدم الإخلال بحق التقاضي ، إذا نشأ نزاع فردى بين صاحب العمل والعامل بشأن تطبيق أحكام هذا القانون ، أو أى من القوانين ذات الصلة كان لأى منهما خلال عشرة أيام من تاريخ نشوء النزاع أن يطلب تسويته وديًا بمعرفة لجنة تشكل على النحو الآتي :
١٥٠,150,مادة (١٥٠) :,150.0,إذا لم تتم تسوية النزاع وديًا يحرر رئيس اللجنة محضرًا بما تم ، ويوقع منه ومن طرفى النزاع ، ويثبت ما تم من أعمال وما تلقته اللجنة من مستندات ورأيها فى موضوع النزاع ، ويحال إلى المحكمة العمالية المختصة بناء على طلب أى من طرفيه ، ويحدد قلم كتاب المحكمة جلسة لنظر النزاع فى مدة لا تجاوز عشرين يومًا من تاريخ ورود الطلب ، وعليه إعلان طرفى النزاع بها .
١٥١,151,مادة (١٥١) :,151.0,إذا تسبب العامل بخطئه ، أو بمناسبة عمله فى فقد ، أو إتلاف مهمات ، أو آلات أو خامات ، أو منتجات أو غيرها ، يملكها صاحب العمل ، أو كانت فى عهدته التزم بأداء قيمة ما فقد ، أو أتلف .
١٥٢,152,مادة (١٥٢) :,152.0,لا تخل الأحكام الواردة بهذا الفصل بالضمانات المقررة بقانون المنظمات النقابية العمالية وحماية حق التنظيم النقابى المشار إليه ، لأعضاء مجالس إداراتالمنظمات النقابية .
١٥٣,153,مادة (١٥٣) :,153.0,يجب على صاحب العمل أن يمسك سجلاً ورقيًا أو إلكترونيًا لقيد الجزاءات المالية الموقعة على العمال ، مع بيان سبب توقيعها واسم العامل ومقدار أجره ،وأن يفرد لحصيلتها حسابًا خاصًا للصرف على عمال المنشأة فى الأغراض الاجتماعية والثقافية والرياضية ، ولا يجوز صرف هذه المبالغ للوفاء بالالتزامات المنصوص عليها فى المادة (272) من هذا القانون وتوزع حصيلة تلك الأموال عند تصفية المنشأة بالتساوى على العمال الموجودين بها وقت التصفية .
١٥٤,154,مادة (١٥٤) :,154.0,مع عدم الإخلال بما نصت عليه المواد (۸۷ ، ۸۸ ، 95) من هذا القانون ،ينتهى عقد العمل محدد المدة بانقضاء مدته .
١٥٥,155,مادة (١٥٥) :,155.0,إذا أبرم عقد العمل لإنجاز عمل معين ، انتهى العقد بإنجاز هذا العمل ، ويجوز تجديده باتفاق صريح بين طرفيه ، وذلك لعمل أو أعمال أخرى مماثلة .
١٥٦,156,مادة (١٥٦) :,156.0,مع عدم الإخلال بأحكام المادة (165) من هذا القانون إذا كان عقد العمل غير محدد المدة ، جاز لأى من طرفيه إنهاؤه بشرط أن يخطر الطرف الآخر كتابة قبل الإنهاء بثلاثة أشهر .
١٥٧,157,مادة (١٥٧) :,157.0,مع عدم الإخلال بحكم المادة (235) من هذا القانون ، ومع مراعاة أحكام المواد من (١٥٨ إلى ١٧٥) من هذا القانون ، لا يجوز لأصحاب الأعمال والعمال إنهاء عقد العمل غير محدد المدة ، إلا بمبرر مشروع وكاف .
١٥٨,158,مادة (١٥٨) :,158.0,لا يجوز تعليق الإخطار بالإنهاء على شرط واقف ، أو فاسخ .
١٥٩,159,مادة (١٥٩) :,159.0,لا يجوز توجيه الإخطار للعامل خلال إجازاته ، ولا تحتسب مهلة الإخطارإلا من اليوم التالى لانتهاء الإجازة ، وإذا حصل العامل على إجازة مرضية خلال مهلة الإخطار يوقف سريان هذه المهلة ولا يبدأ سريانها من جديد إلا من اليوم التالى لانتهاء تلك الإجازة .
١٦٠,160,مادة (١٦٠) :,160.0,يظل عقد العمل قائمًا طوال مهلة الإخطار ، ويلتزم طرفاه بتنفيذ جميع الالتزامات الناشئة عنه وينتهى العقد بانقضاء هذه المهلة .
١٦١,161,مادة (١٦١) :,161.0,لا يجوز الاتفاق على الإعفاء من شرط الإخطار أو تخفيض مدته ، ويجوز الاتفاق على زيادة هذه المدة .
١٦٢,162,مادة (١٦٢) :,162.0,إذا كان الإخطار بالإنهاء من جانب صاحب العمل ، يحق للعامل أن يتغيب يومًا كاملاً فى الأسبوع أو ثمانى ساعات أثناء الأسبوع ، وذلك للبحث عن عمل آخر مع استحقاقه لأجره عن يوم أو ساعات الغياب .
١٦٣,163,مادة (١٦٣) :,163.0,لصاحب العمل أن يعفى العامل من العمل أثناء مهلة الإخطار ، مع احتساب مدة خدمة العامل مستمرة إلى حين انتهاء تلك المهلة ، مع ما يترتب على ذلك من آثار ، وبخاصة استحقاق العامل أجره عن هذه المهلة .
١٦٤,164,مادة (١٦٤) :,164.0,إذا أنهى صاحب العمل عقد العمل غير محدد المدة دون إخطار أو قبل انقضاء مهلة الإخطار ، يلتزم بأن يؤدى للعامل مبلغًا يعادل أجره عن مدة المهلة ، أو الجزء الباقى منها .
١٦٥,165,مادة (١٦٥) :,165.0,إذا أنهى صاحب العمل العقد غير محدد المدة لسبب غير مشروع ، كان للعامل الحق فى تعويض عما أصابه من ضرر بسبب هذا الإنهاء بما لا يقل عن أجر شهرين عن كل سنة من سنوات الخدمة ، ولا يخل ذلك بحق العامل فى المطالبة بباقى حقوقه المقررة قانونًا .
١٦٦,166,مادة (١٦٦) :,166.0,يُعتبر العامل مستقيلاً من العمل إذا تغيب بدون مبرر مشروع أكثر من عشرين يومًا متقطعة خلال السنة الواحدة ، أو أكثر من عشرة أيام متتالية ، على أن يسبق ذلك إنذار بخطاب موصى عليه بعلم الوصول من صاحب العمل ، أو من يمثله ، للعامل بعد غيابه عشرة أيام فى الحالة الأولى ، وخمسة أيام فى الحالة الثانية .
١٦٧,167,مادة (١٦٧) :,167.0,للعامل أن يقدم استقالته كتابة لصاحب العمل بشرط أن تكون موقعة من العاملأو من وكيله الخاص ، ومعتمدة من الجهة الإدارية المختصة .
١٦٨,168,مادة (١٦٨) :,168.0,للعامل إنهاء العقد إذا أخل صاحب العمل بالتزام من التزاماته الجوهرية الناشئة عن هذا القانون ، أو عقد العمل الفردى أو الجماعى ، أو لائحة النظام الأساسى للمنشأة ، أو إذا وقع على العامل ، أو أحد ذويه اعتداء من صاحب العمل ،أو ممن يمثله .
١٦٩,169,مادة (١٦٩) :,169.0,ينتهى عقد العمل بوفاة العامل حقيقة ، أو حكمًا ، طبقًا للقواعد القانونية المقررة ، ولا ينتهى عقد العمل بوفاة صاحب العمل ، إلا إذا كان قد أبرم لاعتبارات تتعلق بشخص صاحب العمل ، أو بنشاطه الذى ينقطع بوفاته .
۱۷۰,170,مادة (۱۷۰) :,170.0,مع عدم الإخلال بأحكام قانون التأمينات الاجتماعية والمعاشات المشار إليه ، ينتهى عقد العمل بعجز العامل عن تأدية عمله عجزًا كليًا ، أيًا كان سبب هذا العجز .
۱۷۱,171,مادة (۱۷۱) :,171.0,لا يجوز تحديد سن للتقاعد تقل عن ستين سنة .
۱۷۲,172,مادة (۱۷۲) :,172.0,يستحق العامل عن مدة عمله بعد سن الستين ، مكافأة بواقع أجر نصف شهر عن كل سنة من السنوات الخمس الأولى من الخدمة ، وأجر شهر عن كل سنة من السنوات التالية لها ، وذلك إذا لم تكن له حقوق عن هذه المدة ، وفقًا لأحكام تأمين الشيخوخة ، والعجز ، والوفاة المنصوص عليها فى قانون التأمينات الاجتماعية والمعاشات المشار إليه .
۱۷۳,173,مادة (۱۷۳) :,173.0,يُحظر على صاحب العمل إنهاء عقد العامل لمرض العامل ، إلا إذا استنفد إجازاته المرضية ، وما تبقى من متجمد إجازاته السنوية المستحقة له ، وذلك مع عدم الإخلال بأحكام قانون التأمينات الاجتماعية والمعاشات المشار إليه .
١٧٤,174,مادة (١٧٤) :,174.0,لصاحب العمل أن ينهى عقد العمل ولو كان محدد المدة ، أو مبرمًا لإنجاز عمل معين إذا حكم نهائيًا على العامل بعقوبة جناية أو بعقوبة مقيدة للحرية فى جريمة ماسة بالشرف أو الأمانة ، وذلك ما لم تأمر المحكمة بوقف تنفيذ العقوبة .
١٧٥,175,مادة (١٧٥) :,175.0,يلتزم صاحب العمل بأن يمكن العامل من الاطلاع على تدرجه الوظيفىوعناصر أجره ، وأن يعطى العامل بناءً على طلبه ودون مقابل شهادة تحدد خبرته وكفاءته المهنية ، وذلك أثناء سريان العقد ، أو عند انتهائه .
١٧٦,176,مادة (١٧٦) :,176.0,"تنشأ بدائرة اختصاص كل محكمة ابتدائية محكمة تسمى ""المحكمة العمالية"" ، كما تنشأ بدائرة كل محكمة من محاكم الاستئناف دوائر استئنافية متخصصة ، لنظر الطعون التى ترفع إليها فى الأحكام الصادرة عن المحكمة العمالية ."
۱۷۷,177,مادة (۱۷۷) :,177.0,تختص المحكمة العمالية المشار إليها فى المادة (176) من هذا القانون ،دون غيرها ، بنظر النزاعات الناشئة عن تطبيق أحكام القوانين واللوائح المنظمة لعلاقات العمل كافة ، وكذلك الدعاوى المتعلقة بحقوق العمال التأمينية والمنتفعين عنهم ، والمنظمات النقابية العمالية وتشكيلاتها ، وذلك دون الإخلال باختصاصات محاكم مجلس الدولة .
۱۷۸,178,مادة (۱۷۸) :,178.0,تشكل كل دائرة من دوائر المحكمة العمالية من ثلاثة من القضاة بالمحاكم الابتدائية ، يكون أحدهم على الأقل بدرجة رئيس من الفئة (أ) .
۱۷۹,179,مادة (۱۷۹) :,179.0,تعين الجمعية العمومية للمحكمة الابتدائية فى بداية كل عام قضائى قاضيًا بدرجة رئيس محكمة من الفئة (أ) ليحكم بصفة مؤقتة مع عدم المساس بأصل الحق فى المسائل المستعجلة التى يخشى عليها من فوات الوقت ، وإصدار الأوامر على عرائض ، والأوامر الوقتية ، وأوامر الأداء فى تلك المسائل أيًا كانت قيمة الحق محل الطلب الذى تختص به المحاكم العمالية .
۱۸۰,180,مادة (۱۸۰) :,180.0,يكون الطعن فى الأحكام ، والتظلم من الأوامر الصادرة عن قاضى الأمور المستعجلة أمام المحاكم العمالية المتخصصة دون غيرها .
۱۸۱,181,مادة (۱۸۱) :,181.0,تختص دوائر المحاكم العمالية بنظر الجرائم الناشئة عن تطبيق أحكام القوانين واللوائح المنظمة لعلاقات العمل ، وحقوق العمال التأمينية والمنتفعين عنهم ، والمنظمات النقابية العمالية وتشكيلاتها ويكون استئنافها أمام الدوائرالاستئنافية المتخصصة .
۱۸۲,182,مادة (۱۸۲) :,182.0,لا يجوز الطعن بالنقض فى الأحكام الصادرة عن الدوائر الاستئنافية المتخصصة فى الجرائم الناشئة عن تطبيق أحكام القوانين واللوائح المنظمة لعلاقات العمل ، وحقوق العمال التأمينية والمنتفعين عنهم ، والمنظمات النقابية العمالية وتشكيلاتها ،فى غير الأحوال الصادر فيها أحكام بعقوبة مقيدة للحرية .
۱۸۳,183,مادة (۱۸۳) :,183.0,تختص المحكمة العمالية بالفصل فى منازعات التنفيذ الوقتية والموضوعيةفى الأحكام والأوامر الصادرة عنها ، أو تلك التى تصدر وفقًا للمادة (179) من هذا القانون ، ويطعن فى الأحكام الصادرة عنها أمام الدوائر الاستئنافية المتخصصة .
١٨٤,184,مادة (١٨٤) :,184.0,ينشأ فى دائرة اختصاص المحكمة العمالية قلم كتاب خاص بالمحكمة ، وإدارة خاصة لتنفيذ الأحكام ، والقرارات الصادرة عنها ، أو عن دوائرها الاستئنافية .
١٨٥,185,مادة (١٨٥) :,185.0,ينشأ فى مقر كل محكمة ابتدائية ، وكذا بكل مقر آخر تنعقد فيه المحكمة العمالية ، مكتب للمساعدة القانونية العمالية يناط به كل ما من شأنه معاونة المتقاضين فى إقامة دعواهم العمالية على الوجه القانونى الصحيح ، وتكون سائر خدمات هذا المكتب للمتقاضين اختيارية ، ودون مقابل .
١٨٦,186,مادة (١٨٦) :,186.0,تشكل بمحكمة النقض دائرة أو أكثر تختص دون غيرها ، بالفصل فى الطعون بالنقض فى الأحكام الصادرة عن المحاكم العمالية .
۱۸۷,187,مادة (۱۸۷) :,187.0,تتبع فى الطعن على أحكام المحاكم العمالية الأحكام الواردة فى قوانين الإجراءات الجنائية ، وحالات وإجراءات الطعن أمام محكمة النقض ، والمرافعات المدنية والتجارية ، والإثبات فى المواد المدنية والتجارية ، بحسب الأحوال ، وذلك فيما لم يرد بشأنه نص خاص فى هذا القانون .
